### ISSUE TITLE
Private routing set to 10.0.0.8 instead of 10.0.0.0/8, causes problem with haproxy acl whitelists

### ISSUE THREAD

**Issue by ccollicutt** [OpenStackSanDiego/osa-workshop#9]
Eg. currently the `acl white_list` is just private IPs.

```
frontend nova_api_placement-front-1
    bind 10.99.235.129:8780
    option httplog
    option forwardfor except 127.0.0.0/8
    option http-server-close
    acl white_list src 127.0.0.1/8 192.168.0.0/16 172.16.0.0/12 10.0.0.0/8 
    tcp-request content accept if white_list
    tcp-request content reject
    mode http
    default_backend nova_api_placement-back
```

The compute node connections for 8780 are coming from its public IP.

```
root@infra0:/etc/haproxy# tcpdump -n -e -ttt -i bond0 port 8780
tcpdump: verbose output suppressed, use -v or -vv for full protocol decode
listening on bond0, link-type EN10MB (Ethernet), capture size 262144 bytes
 00:00:00.000000 f4:b5:2f:4f:ed:b8 > 0c:c4:7a:15:e4:32, ethertype IPv4 (0x0800), length 74: 147.75.196.151.44550 > 10.99.235.129.8780: Flags [S], seq 1507958381, win 29200, options [mss 1460,sackOK,TS val 8847312 ecr 0,nop,wscale 8], length 0
 00:00:00.000048 0c:c4:7a:15:e4:32 > f4:b5:2f:4f:ed:b8, ethertype IPv4 (0x0800), length 74: 10.99.235.129.8780 > 147.75.196.151.44550: Flags [S.], seq 758515281, ack 1507958382, win 28960, options [mss 1460,sackOK,TS val 2680876400 ecr 8847312,nop,wscale 8], length 0
 00:00:00.000111 f4:b5:2f:4f:ed:b8 > 0c:c4:7a:15:e4:32, ethertype IPv4 (0x0800), length 66: 147.75.196.151.44550 > 10.99.235.129.8780: Flags [.], ack 1, win 115, options [nop,nop,TS val 8847312 ecr 2680876400], length 0
```

So either 1) need to have the compute node use it's private IP only (which actually might make sense, just remove the public IP entireley) or 2) setup the acl to allow the public IPs of the compute nodes.

This is what I see when curling 8780 from the compute node:

```
root@compute0:~# curl -vv 10.99.235.129:8780/
*   Trying 10.99.235.129...
* TCP_NODELAY set
* Connected to 10.99.235.129 (10.99.235.129) port 8780 (#0)
> GET / HTTP/1.1
> Host: 10.99.235.129:8780
> User-Agent: curl/7.58.0
> Accept: */*
> 
* Empty reply from server
* Connection #0 to host 10.99.235.129 left intact
curl: (52) Empty reply from server
```

and from the infra node:

```
root@infra0:/etc/haproxy# curl 10.99.235.129:8780
{"versions": [{"status": "CURRENT", "min_version": "1.0", "max_version": "1.29", "id": "v1.0", "links": [{"href": "", "rel": "self"}]}]}
```

**Comment by ccollicutt** [comment]
Could use "policy based routing" perhaps to make this work? I'm not sure why traffic to 10.0.0.0/8 IPs doesn't appear to come from the private IP.

**Comment by ccollicutt** [comment]
I see one issue in that there is a typo in the bridge script that sets the route to 10.0.0.8 instead of 10.0.0.0/8:

```
root@compute0:~# ip ro sh
default via 147.75.196.150 dev br-mgmt 
10.0.0.8 via 10.99.235.130 dev br-mgmt 
10.99.235.130/31 dev br-mgmt proto kernel scope link src 10.99.235.131 
10.99.235.192/27 dev br-mgmt proto kernel scope link src 10.99.235.193 
147.75.196.150/31 dev br-mgmt proto kernel scope link src 147.75.196.151 
root@compute0:~# 
```

Not sure that is the actual problem though.

**Comment by ccollicutt** [comment]
Yup that seems to have been it:

```
root@infra0:~# tcpdump -n -e -ttt -i bond0 port 8780
tcpdump: verbose output suppressed, use -v or -vv for full protocol decode
listening on bond0, link-type EN10MB (Ethernet), capture size 262144 bytes
^[[6~ 00:00:00.000000 f4:b5:2f:4f:ed:b8 > 0c:c4:7a:15:e4:32, ethertype IPv4 (0x0800), length 74: 10.99.235.131.58382 > 10.99.235.129.8780: Flags [S], seq 1568425387, win 29200, options [mss 1460,sackOK,TS val 118063939 ecr 0,nop,wscale 8], length 0
 00:00:00.000097 0c:c4:7a:15:e4:32 > f4:b5:2f:4f:ed:b8, ethertype IPv4 (0x0800), length 74: 10.99.235.129.8780 > 10.99.235.131.58382: Flags [S.], seq 3097325070, ack 1568425388, win 28960, options [mss 1460,sackOK,TS val 979111261 ecr 118063939,nop,wscale 8], length 0
 00:00:00.000082 f4:b5:2f:4f:ed:b8 > 0c:c4:7a:15:e4:32, ethertype IPv4 (0x0800), length 66: 10.99.235.131.58382 > 10.99.235.129.8780: Flags [.], ack 1, win 115, options [nop,nop,TS val 118063940 ecr 979111261], length 0
 00:00:00.000049 f4:b5:2f:4f:ed:b8 >
```
Curl works now.

```
root@compute0:~# curl 10.99.235.129:8780/
{"versions": [{"status": "CURRENT", "min_version": "1.0", "max_version": "1.29", "id": "v1.0", "links": [{"href": "", "rel": "self"}]}]}root@compute0:~# 
```
